<?xml version="1.0" encoding="UTF-8"?>
<xs:schema xmlns:xs="http://www.w3.org/2001/XMLSchema">
  <xs:element name="cartelera">
    <xs:complexType>
      <xs:sequence>
        <xs:element name="pelicula" maxOccurs="unbounded">
          <xs:complexType>
            <xs:sequence>
              <xs:element name="titulo" type="xs:string"/>
              <xs:element name="fecha" type="xs:date"/>
              <xs:element name="genero" type="xs:string"/>
              <xs:element name="director" type="xs:string"/>
              <xs:element name="actores">
                <xs:complexType>
                  <xs:sequence>
                    <xs:element name="actor" type="xs:string" maxOccurs="unbounded"/>
                  </xs:sequence>
                </xs:complexType>
              </xs:element>
              <xs:element name="duracion" type="xs:string"/>
            </xs:sequence>
          </xs:complexType>
        </xs:element>
      </xs:sequence>
    </xs:complexType>
  </xs:element>
</xs:schema>
